{
  "$schema": "https://json-schema.org/draft/2020-12/schema",
  "$id": "urn:lynx-view-monitoring:build-manifest:1.0",
  "title": "Lynx debugging artifact manifest v1.0 design contract",
  "type": "object", "additionalProperties": false,
  "required": ["schemaVersion", "buildId", "createdAt", "source", "toolchain", "entries"],
  "properties": {
    "schemaVersion": {"const": "1.0"}, "buildId": {"$ref": "#/$defs/text"}, "createdAt": {"type": "string", "pattern": "^\\d{4}-\\d{2}-\\d{2}T\\d{2}:\\d{2}:\\d{2}(\\.\\d+)?Z$"},
    "source": {
      "type": "object", "additionalProperties": false, "required": ["gitCommit", "dirty", "lockfileSha256", "sourceContext"],
      "properties": {"gitCommit": {"type": ["string", "null"], "pattern": "^[0-9a-f]{40}([0-9a-f]{24})?$"}, "dirty": {"type": "boolean"}, "lockfileSha256": {"$ref": "#/$defs/sha256"}, "sourceContext": {"enum": ["sources_content", "snapshot", "none"]}}
    },
    "toolchain": {
      "type": "object", "additionalProperties": false, "required": ["engineTarget", "rspeedy", "reactLynx", "reactPlugin", "debugMetadataPlugin"],
      "properties": {"engineTarget": {"$ref": "#/$defs/text"}, "rspeedy": {"$ref": "#/$defs/text"}, "reactLynx": {"$ref": "#/$defs/text"}, "reactPlugin": {"$ref": "#/$defs/text"}, "debugMetadataPlugin": {"$ref": "#/$defs/text"}}
    },
    "entries": {"type": "array", "minItems": 1, "items": {"$ref": "#/$defs/entry"}}
  },
  "$defs": {
    "text": {"type": "string", "minLength": 1, "maxLength": 2048},
    "nullableText": {"type": ["string", "null"], "minLength": 1, "maxLength": 2048},
    "sha256": {"type": "string", "pattern": "^[0-9a-f]{64}$"},
    "file": {
      "type": "object", "additionalProperties": false, "required": ["path", "sha256", "sizeBytes"],
      "properties": {"path": {"type": "string", "minLength": 1, "pattern": "^(?!/)(?!.*(?:^|/)\\.\\.(?:/|$))(?!.*[:\\\\]).+$"}, "sha256": {"$ref": "#/$defs/sha256"}, "sizeBytes": {"type": "integer", "minimum": 1}}
    },
    "entry": {
      "type": "object", "additionalProperties": false, "required": ["entryId", "bundleName", "lynxAppId", "targetPlatforms", "bundle", "debugMetadata", "scripts"],
      "properties": {
        "entryId": {"$ref": "#/$defs/text"}, "bundleName": {"$ref": "#/$defs/text"}, "lynxAppId": {"$ref": "#/$defs/nullableText"},
        "targetPlatforms": {"type": "array", "minItems": 1, "uniqueItems": true, "items": {"enum": ["android", "ios", "harmony"]}},
        "bundle": {"$ref": "#/$defs/file"}, "debugMetadata": {"$ref": "#/$defs/file"},
        "scripts": {"type": "array", "minItems": 1, "items": {"$ref": "#/$defs/script"}}
      }
    },
    "script": {
      "type": "object", "additionalProperties": false, "required": ["artifactName", "artifactKind", "sourceMapKey", "runtimeRelease", "sourceMapName", "hasBytecodeDebugInfo"],
      "properties": {
        "artifactName": {"$ref": "#/$defs/text"}, "artifactKind": {"$ref": "#/$defs/text"}, "sourceMapKey": {"$ref": "#/$defs/text"},
        "runtimeRelease": {"type": "string", "pattern": "^debugmetadata:.+$"}, "sourceMapName": {"$ref": "#/$defs/text"}, "hasBytecodeDebugInfo": {"type": "boolean"}
      }
    }
  }
}
